{
  "version": 2,
  "type": "wardrobe",
  "W": 1000,
  "H": 2000,
  "D": 600,
  "plinth": 100,
  "sections": [
    {
      "width": "auto",
      "zones": [
        {
          "type": "shelves",
          "count": 3,
          "height": "auto"
        },
        {
          "type": "drawers",
          "count": 2,
          "height": 400
        }
      ]
    }
  ],
  "base": "legs"
}
